{
  "status_type": "FORGE_BUILD_STATE",
  "current_stage": null,
  "current_task": "",
  "last_completed_artifact": "artifacts/tasks/TASK-067.execution.closure.md",
  "closed_tasks": [
    "TASK-047",
    "TASK-048",
    "TASK-050",
    "TASK-051",
    "TASK-066",
    "TASK-052",
    "TASK-053",
    "TASK-054",
    "TASK-061",
    "TASK-055",
    "TASK-067"
  ],
  "open_tasks": [],
  "pending_gaps": [],
  "build_progress_percent": 100,
  "execution_integrity": "CONSISTENT",
  "next_allowed_step": "COMPLETE",
  "derived_from": {
    "registry": "code/src/execution/task_registry.js",
    "task_artifacts_directory": "artifacts/tasks",
    "closure_artifacts": [
      "artifacts/tasks/TASK-047.execution.closure.md",
      "artifacts/tasks/TASK-048.execution.closure.md",
      "artifacts/tasks/TASK-050.execution.closure.md",
      "artifacts/tasks/TASK-051.execution.closure.md",
      "artifacts/tasks/TASK-052.execution.closure.md",
      "artifacts/tasks/TASK-053.execution.closure.md",
      "artifacts/tasks/TASK-054.execution.closure.md",
      "artifacts/tasks/TASK-055.execution.closure.md",
      "artifacts/tasks/TASK-061.execution.closure.md",
      "artifacts/tasks/TASK-066.execution.closure.md",
      "artifacts/tasks/TASK-067.execution.closure.md"
    ]
  },
  "derived_at": "2026-04-02T19:13:43.794Z"
}